{
  "$schema": "./capability-inventory.schema.json",
  "schemaVersion": 1,
  "inventoryVersion": "2026-10-10.9",
  "observedOn": "2026-10-10",
  "reviewState": "draft-for-review",
  "reference": {
    "project": "ExifTool",
    "sourceVersion": "13.59",
    "commit": "2200871d9cef988051d2a99d67df3bda6cbb30a8",
    "commitDate": "2026-05-27T16:44:48Z",
    "executableVersion": "13.59",
    "executableSha256": "a6b8018093845ac93011307bac4ab630d6604b2365fc7f66bb88c88d7dedb5ed",
    "runtimeExperiments": true
  },
  "scope": "EOS R5 full RAW CR3 metadata first, associated XMP and stored previews; C-RAW and Dual Pixel RAW secondary. Language agnostic. Initial private reference-only observations in docs/corpus-baseline; no imageinfo implementation or parity results. Executable hash identifies the interpreted entry script, with complete toolchain identities retained privately.",
  "variants": [
    {
      "id": "r5-full",
      "container": "CR3",
      "camera": "Canon EOS R5",
      "captureMode": "full RAW",
      "priority": "primary",
      "notes": "User-selected losslessly compressed full RAW. Eight private files characterized at firmware 2.2.1; stored mode observations and coverage limits in docs/corpus-baseline. No native or general variant support claim."
    },
    {
      "id": "r5-xmp",
      "container": "XMP",
      "camera": "Canon EOS R5 association",
      "captureMode": "sidecar paired with r5-full",
      "priority": "primary",
      "notes": "Association and conflict policy required; never infer embedded CR3 write support from sidecar support."
    },
    {
      "id": "r5-craw",
      "container": "CR3",
      "camera": "Canon EOS R5",
      "captureMode": "C-RAW",
      "priority": "secondary",
      "notes": "Separate evidence; not a gate for the first full-RAW read milestone."
    },
    {
      "id": "r5-dpraw",
      "container": "CR3",
      "camera": "Canon EOS R5",
      "captureMode": "Dual Pixel RAW",
      "priority": "secondary",
      "notes": "User has not stated use; additional sensor data preservation remains a separate gate."
    }
  ],
  "sources": [
    {
      "id": "support",
      "title": "Upstream support and writer limitations",
      "url": "https://github.com/exiftool/exiftool/blob/2200871d9cef988051d2a99d67df3bda6cbb30a8/html/index.html",
      "locator": "CR3 row; writer limitations",
      "basis": "upstream-documentation"
    },
    {
      "id": "canon",
      "title": "Canon metadata tables",
      "url": "https://github.com/exiftool/exiftool/blob/2200871d9cef988051d2a99d67df3bda6cbb30a8/html/TagNames/Canon.html",
      "locator": "uuid, CTMD, CameraSettings, CameraInfoR6, CanonModelID",
      "basis": "upstream-documentation"
    },
    {
      "id": "canon-source",
      "title": "Canon reader/writer definitions",
      "url": "https://github.com/exiftool/exiftool/blob/2200871d9cef988051d2a99d67df3bda6cbb30a8/lib/Image/ExifTool/Canon.pm",
      "locator": "Canon::uuid CMT1-4, CTBO, THMB; Canon::CTMD; ProcessCMT3",
      "basis": "upstream-source"
    },
    {
      "id": "quicktime",
      "title": "QuickTime metadata tables",
      "url": "https://github.com/exiftool/exiftool/blob/2200871d9cef988051d2a99d67df3bda6cbb30a8/html/TagNames/QuickTime.html",
      "locator": "CR3 padding; Stream CTMD and JpgFromRaw; uuid",
      "basis": "upstream-documentation"
    },
    {
      "id": "quicktime-source",
      "title": "QuickTime container implementation",
      "url": "https://github.com/exiftool/exiftool/blob/2200871d9cef988051d2a99d67df3bda6cbb30a8/lib/Image/ExifTool/QuickTime.pm",
      "locator": "ftypLookup crx; timeInfo CR3 conversion; Canon uuid preview; JPEGInfo",
      "basis": "upstream-source"
    },
    {
      "id": "exif",
      "title": "EXIF definitions",
      "url": "https://github.com/exiftool/exiftool/blob/2200871d9cef988051d2a99d67df3bda6cbb30a8/html/TagNames/EXIF.html",
      "locator": "IFD0/ExifIFD fields; writable/protected/mandatory flags",
      "basis": "upstream-documentation"
    },
    {
      "id": "gps",
      "title": "GPS definitions",
      "url": "https://github.com/exiftool/exiftool/blob/2200871d9cef988051d2a99d67df3bda6cbb30a8/html/TagNames/GPS.html",
      "locator": "coordinate/reference fields; GPSVersionID",
      "basis": "upstream-documentation"
    },
    {
      "id": "xmp",
      "title": "XMP definitions",
      "url": "https://github.com/exiftool/exiftool/blob/2200871d9cef988051d2a99d67df3bda6cbb30a8/html/TagNames/XMP.html",
      "locator": "dc, xmp, exif schemas and list/language/structure types",
      "basis": "upstream-documentation"
    },
    {
      "id": "structures",
      "title": "Structured XMP",
      "url": "https://github.com/exiftool/exiftool/blob/2200871d9cef988051d2a99d67df3bda6cbb30a8/html/struct.html",
      "locator": "read/copy/write structure and flattened-field behavior",
      "basis": "upstream-documentation"
    },
    {
      "id": "sidecars",
      "title": "Metadata sidecars",
      "url": "https://github.com/exiftool/exiftool/blob/2200871d9cef988051d2a99d67df3bda6cbb30a8/html/metafiles.html",
      "locator": "XMP creation, mapping, application",
      "basis": "upstream-documentation"
    },
    {
      "id": "cli",
      "title": "Application manual",
      "url": "https://github.com/exiftool/exiftool/blob/2200871d9cef988051d2a99d67df3bda6cbb30a8/html/exiftool_pod.html",
      "locator": "tag operations; input/output; processing; other options; special features; exit status",
      "basis": "upstream-documentation"
    },
    {
      "id": "api",
      "title": "Library API",
      "url": "https://github.com/exiftool/exiftool/blob/2200871d9cef988051d2a99d67df3bda6cbb30a8/lib/Image/ExifTool.pod",
      "locator": "ImageInfo, ExtractInfo, GetInfo, GetValue, SetNewValue, WriteInfo, options and static discovery",
      "basis": "upstream-source"
    },
    {
      "id": "values",
      "title": "Information and conversion flow",
      "url": "https://github.com/exiftool/exiftool/blob/2200871d9cef988051d2a99d67df3bda6cbb30a8/html/under.html",
      "locator": "Raw, ValueConv, PrintConv; read/write flow",
      "basis": "upstream-documentation"
    },
    {
      "id": "composite",
      "title": "Composite definitions",
      "url": "https://github.com/exiftool/exiftool/blob/2200871d9cef988051d2a99d67df3bda6cbb30a8/html/TagNames/Composite.html",
      "locator": "derived values; preview extraction/replacement distinctions",
      "basis": "upstream-documentation"
    },
    {
      "id": "files",
      "title": "Filename workflows",
      "url": "https://github.com/exiftool/exiftool/blob/2200871d9cef988051d2a99d67df3bda6cbb30a8/html/filename.html",
      "locator": "FileName, Directory, TestName, formatting and collisions",
      "basis": "upstream-documentation"
    },
    {
      "id": "geo",
      "title": "Geotagging",
      "url": "https://github.com/exiftool/exiftool/blob/2200871d9cef988051d2a99d67df3bda6cbb30a8/html/geotag.html",
      "locator": "track interpolation, Geotime, Geosync",
      "basis": "upstream-documentation"
    },
    {
      "id": "extra",
      "title": "Filesystem and extra tags",
      "url": "https://github.com/exiftool/exiftool/blob/2200871d9cef988051d2a99d67df3bda6cbb30a8/html/TagNames/Extra.html",
      "locator": "System, warnings, validation, ImageDataHash",
      "basis": "upstream-documentation"
    },
    {
      "id": "config",
      "title": "Configuration examples",
      "url": "https://github.com/exiftool/exiftool/blob/2200871d9cef988051d2a99d67df3bda6cbb30a8/config_files/example.config",
      "locator": "custom tags, composites, executable callbacks",
      "basis": "upstream-source"
    },
    {
      "id": "canon-modes",
      "title": "Canon EOS R5 capture modes",
      "url": "https://cam.start.canon/en/C003/manual/html/UG-03_Shooting-1_0030.html",
      "locator": "RAW and Compact RAW; CR3 naming",
      "basis": "vendor-documentation"
    },
    {
      "id": "canon-dpraw",
      "title": "Canon EOS R5 Dual Pixel RAW",
      "url": "https://support.usa.canon.com/kb/index?id=ART178251&page=content",
      "locator": "Additional dual pixel sensor information and recording mode",
      "basis": "vendor-documentation"
    }
  ],
  "capabilities": [
    {
      "id": "CAP-001",
      "subject": "Recognize a CR3 still container",
      "variantRefs": [
        "r5-full"
      ],
      "family": "container",
      "location": "ftyp and Canon container structures",
      "selectors": [
        "FileType",
        "MajorBrand",
        "CompressorVersion"
      ],
      "operation": "recognize",
      "milestone": "read-foundation",
      "priority": "P0",
      "reference": {
        "support": "conditional",
        "sourceRefs": [
          "quicktime-source",
          "support"
        ],
        "note": "The crx brand covers CR3/CRM; upstream uses additional Canon compressor context. Extension alone is insufficient."
      },
      "status": "specified",
      "target": "Recognize still RAW separately from video and distinguish corrupt, unsupported and ambiguous input.",
      "acceptance": [
        "Correct, missing and misleading extensions plus CRM and truncated-box negatives yield explicit classification without guessing."
      ],
      "requirementRefs": [
        "PR-002"
      ],
      "gapRefs": [
        "GAP-001",
        "GAP-008"
      ],
      "dependsOn": [],
      "evidence": [],
      "statusNote": "Specified; no imageinfo implementation or native runtime evidence. Initial bounded upstream-only observations are documented in docs/corpus-baseline; they do not verify this entire capability row.",
      "implementationRevision": null
    },
    {
      "id": "CAP-002",
      "subject": "Identify EOS R5 and full RAW evidence",
      "variantRefs": [
        "r5-full"
      ],
      "family": "Canon identification",
      "location": "EXIF model and Canon maker-note/capture fields",
      "selectors": [
        "Make",